{
  "schema_version": 1,
  "domain": "joinnorth.it",
  "name": "JoinNorth",
  "website": "https://joinnorth.it/",
  "profile": "https://jobsitedir.com/jobboard/joinnorth.it?utm_source=github&utm_medium=referral&utm_campaign=public-directory&utm_content=record",
  "site_type": "Niche_Geo",
  "primary_country": "CA",
  "primary_industry": "Technical",
  "description": "JoinNorth scans Canadian employer career pages to find tech openings and organizes them with filters for role, seniority, technologies, location, and work model.",
  "logo": {
    "path": "../assets/logos/joinnorth.it.webp",
    "notice": "Logos and website screenshots are provided for identification and reference. Rights belong to their respective owners. Their inclusion does not imply endorsement.",
    "captured_at": null
  },
  "screenshot": {
    "path": "../assets/screenshots/joinnorth.it.webp",
    "notice": "Logos and website screenshots are provided for identification and reference. Rights belong to their respective owners. Their inclusion does not imply endorsement.",
    "captured_at": null
  }
}
