{
  "schema_version": 1,
  "domain": "jobijoba.ie",
  "name": "Jobijoba Ireland",
  "website": "https://jobijoba.ie/",
  "profile": "https://jobsitedir.com/jobboard/jobijoba.ie?utm_source=github&utm_medium=referral&utm_campaign=public-directory&utm_content=record",
  "site_type": "Niche_Geo",
  "primary_country": "IE",
  "primary_industry": null,
  "description": "Jobijoba Ireland is a job search platform covering all of Ireland, listing jobs from 79 companies across 50 industries and 3665 job titles.",
  "logo": {
    "path": "../assets/logos/jobijoba.ie.webp",
    "notice": "Logos and website screenshots are provided for identification and reference. Rights belong to their respective owners. Their inclusion does not imply endorsement.",
    "captured_at": null
  },
  "screenshot": {
    "path": "../assets/screenshots/jobijoba.ie.webp",
    "notice": "Logos and website screenshots are provided for identification and reference. Rights belong to their respective owners. Their inclusion does not imply endorsement.",
    "captured_at": null
  }
}
