{
  "schema_version": 1,
  "domain": "jobs.trax.ng",
  "name": "Trax Jobs",
  "website": "https://jobs.trax.ng/",
  "profile": "https://jobsitedir.com/jobboard/jobs.trax.ng?utm_source=github&utm_medium=referral&utm_campaign=public-directory&utm_content=record",
  "site_type": "Niche_Geo",
  "primary_country": "NG",
  "primary_industry": "Technical>General Tech & IT",
  "description": "Trax Jobs is a curated job board for the African tech ecosystem, with every listing manually reviewed.",
  "logo": {
    "path": "../assets/logos/jobs.trax.ng.webp",
    "notice": "Logos and website screenshots are provided for identification and reference. Rights belong to their respective owners. Their inclusion does not imply endorsement.",
    "captured_at": null
  },
  "screenshot": {
    "path": "../assets/screenshots/jobs.trax.ng.webp",
    "notice": "Logos and website screenshots are provided for identification and reference. Rights belong to their respective owners. Their inclusion does not imply endorsement.",
    "captured_at": null
  }
}
