{
  "schema_version": 1,
  "domain": "annonay-emplois.com",
  "name": "Annonay Emplois",
  "website": "https://annonay-emplois.com/",
  "profile": "https://jobsitedir.com/jobboard/annonay-emplois.com?utm_source=github&utm_medium=referral&utm_campaign=public-directory&utm_content=record",
  "site_type": "Niche_Geo",
  "primary_country": "FR",
  "primary_industry": "Education",
  "description": "Annonay-emplois.com is a job board focused on Annonay, France, listing 924 offers with features like email alerts and domain-based browsing.",
  "logo": {
    "path": "../assets/logos/annonay-emplois.com.webp",
    "notice": "Logos and website screenshots are provided for identification and reference. Rights belong to their respective owners. Their inclusion does not imply endorsement.",
    "captured_at": null
  },
  "screenshot": {
    "path": "../assets/screenshots/annonay-emplois.com.webp",
    "notice": "Logos and website screenshots are provided for identification and reference. Rights belong to their respective owners. Their inclusion does not imply endorsement.",
    "captured_at": null
  }
}
