{
  "schema_version": 1,
  "domain": "healthcarelink.com.au",
  "name": "HealthcareLink",
  "website": "https://healthcarelink.com.au/",
  "profile": "https://jobsitedir.com/jobboard/healthcarelink.com.au?utm_source=github&utm_medium=referral&utm_campaign=public-directory&utm_content=record",
  "site_type": "Niche_Industry",
  "primary_country": "AU",
  "primary_industry": "Healthcare",
  "description": "HealthcareLink is an Australian job platform for healthcare professionals, offering permanent, locum, and subcontract roles across sectors like primary care, aged care, and…",
  "logo": {
    "path": "../assets/logos/healthcarelink.com.au.webp",
    "notice": "Logos and website screenshots are provided for identification and reference. Rights belong to their respective owners. Their inclusion does not imply endorsement.",
    "captured_at": null
  },
  "screenshot": {
    "path": "../assets/screenshots/healthcarelink.com.au.webp",
    "notice": "Logos and website screenshots are provided for identification and reference. Rights belong to their respective owners. Their inclusion does not imply endorsement.",
    "captured_at": null
  }
}
