{
  "schema_version": 1,
  "domain": "jobsretail.co.uk",
  "name": "JobsRetail",
  "website": "https://jobsretail.co.uk/",
  "profile": "https://jobsitedir.com/jobboard/jobsretail.co.uk?utm_source=github&utm_medium=referral&utm_campaign=public-directory&utm_content=record",
  "site_type": "Niche_Industry",
  "primary_country": "GB",
  "primary_industry": "Retail",
  "description": "JobsRetail.co.uk is a UK-focused job board listing 1,594 retail jobs, covering roles from sales assistant to store manager and locations including Birmingham, Manchester, and…",
  "logo": null,
  "screenshot": {
    "path": "../assets/screenshots/jobsretail.co.uk.webp",
    "notice": "Logos and website screenshots are provided for identification and reference. Rights belong to their respective owners. Their inclusion does not imply endorsement.",
    "captured_at": null
  }
}
